<?xml version="1.0" encoding="UTF-8"?>

<telemetry clusterId="Test" agentId="Serial Number Electricity Meter"
	xmlns="http://www.powermatcher.net/TelemetrySchema" xmlns:xsi="http://www.w3.org/2001/XMLSchema-instance"
	xsi:schemaLocation="http://www.powermatcher.net/TelemetrySchema TelemetrySchema.xsd ">
	<measurement valueName="currentUsage" units="W">
		<singleValue value="1.0" timestamp="2001-12-31T12:00:10.000+01:00" />
	</measurement>
	<measurement valueName="meterReading" units="Wh">
		<singleValue value="2000.0" timestamp="2001-12-31T12:00:00.000+01:00" />
		<singleValue value="2010.0" timestamp="2001-12-31T12:00:10.000+01:00" />
	</measurement>
	<measurement units="Wh" valueName="periodicUsage">
		<singleValue value="10.0" timestamp="2001-12-31T12:00:00.000+01:00"
			period="60" />
	</measurement>
</telemetry>